18:38:04.390808 IP localhost.56566 > localhost.44444: Flags [S], seq 2276546786, win 65495, options [mss 65495,sackOK,TS val 1692275103 ecr 0,nop,wscale 7], length 0
18:38:04.390820 IP localhost.44444 > localhost.56566: Flags [S.], seq 2950319929, ack 2276546787, win 65483, options [mss 65495,sackOK,TS val 1692275104 ecr 1692275103,nop,wscale 7], length 0
18:38:04.390832 IP localhost.56566 > localhost.44444: Flags [.], ack 1, win 512, options [nop,nop,TS val 1692275104 ecr 1692275104], length 0
18:38:04.390869 IP localhost.56566 > localhost.44444: Flags [P.], seq 1:49, ack 1, win 512, options [nop,nop,TS val 1692275104 ecr 1692275104], length 48
18:38:04.390874 IP localhost.44444 > localhost.56566: Flags [.], ack 49, win 512, options [nop,nop,TS val 1692275104 ecr 1692275104], length 0
18:38:04.390884 IP localhost.56566 > localhost.44444: Flags [P.], seq 49:88, ack 1, win 512, options [nop,nop,TS val 1692275104 ecr 1692275104], length 39
18:38:04.390888 IP localhost.44444 > localhost.56566: Flags [.], ack 88, win 512, options [nop,nop,TS val 1692275104 ecr 1692275104], length 0
18:38:04.920580 IP localhost.44444 > localhost.56566: Flags [P.], seq 1:14, ack 88, win 512, options [nop,nop,TS val 1692275633 ecr 1692275104], length 13
18:38:04.920644 IP localhost.56566 > localhost.44444: Flags [.], ack 14, win 512, options [nop,nop,TS val 1692275633 ecr 1692275633], length 0
18:38:05.420389 IP localhost.56568 > localhost.44444: Flags [S], seq 2218172540, win 65495, options [mss 65495,sackOK,TS val 1692276133 ecr 0,nop,wscale 7], length 0
18:38:05.420407 IP localhost.44444 > localhost.56568: Flags [S.], seq 3455594214, ack 2218172541, win 65483, options [mss 65495,sackOK,TS val 1692276133 ecr 1692276133,nop,wscale 7], length 0
18:38:05.420443 IP localhost.56568 > localhost.44444: Flags [.], ack 1, win 512, options [nop,nop,TS val 1692276133 ecr 1692276133], length 0
18:38:05.420492 IP localhost.56568 > localhost.44444: Flags [P.], seq 1:49, ack 1, win 512, options [nop,nop,TS val 1692276133 ecr 1692276133], length 48
18:38:05.420498 IP localhost.44444 > localhost.56568: Flags [.], ack 49, win 512, options [nop,nop,TS val 1692276133 ecr 1692276133], length 0
18:38:05.420516 IP localhost.56568 > localhost.44444: Flags [P.], seq 49:88, ack 1, win 512, options [nop,nop,TS val 1692276133 ecr 1692276133], length 39
18:38:05.420520 IP localhost.44444 > localhost.56568: Flags [.], ack 88, win 512, options [nop,nop,TS val 1692276133 ecr 1692276133], length 0
18:38:06.022335 IP localhost.44444 > localhost.56568: Flags [P.], seq 1:14, ack 88, win 512, options [nop,nop,TS val 1692276735 ecr 1692276133], length 13
18:38:06.022456 IP localhost.56568 > localhost.44444: Flags [.], ack 14, win 512, options [nop,nop,TS val 1692276735 ecr 1692276735], length 0
18:38:09.328325 IP localhost.56566 > localhost.44444: Flags [P.], seq 88:100, ack 14, win 512, options [nop,nop,TS val 1692280041 ecr 1692275633], length 12
18:38:09.328359 IP localhost.44444 > localhost.56566: Flags [.], ack 100, win 512, options [nop,nop,TS val 1692280041 ecr 1692280041], length 0
18:38:09.328391 IP localhost.44444 > localhost.56566: Flags [P.], seq 14:22, ack 100, win 512, options [nop,nop,TS val 1692280041 ecr 1692280041], length 8
18:38:09.328419 IP localhost.56566 > localhost.44444: Flags [.], ack 22, win 512, options [nop,nop,TS val 1692280041 ecr 1692280041], length 0
18:38:12.029831 IP localhost.56568 > localhost.44444: Flags [P.], seq 88:127, ack 14, win 512, options [nop,nop,TS val 1692282742 ecr 1692276735], length 39
18:38:12.029969 IP localhost.44444 > localhost.56568: Flags [.], ack 127, win 512, options [nop,nop,TS val 1692282743 ecr 1692282742], length 0
18:38:15.335980 IP localhost.56566 > localhost.44444: Flags [P.], seq 100:139, ack 22, win 512, options [nop,nop,TS val 1692286049 ecr 1692280041], length 39
18:38:15.336124 IP localhost.44444 > localhost.56566: Flags [.], ack 139, win 512, options [nop,nop,TS val 1692286049 ecr 1692286049], length 0
18:38:17.574477 IP localhost.56568 > localhost.44444: Flags [P.], seq 127:139, ack 14, win 512, options [nop,nop,TS val 1692288287 ecr 1692282743], length 12
18:38:17.574521 IP localhost.44444 > localhost.56568: Flags [.], ack 139, win 512, options [nop,nop,TS val 1692288287 ecr 1692288287], length 0
18:38:17.574582 IP localhost.44444 > localhost.56568: Flags [P.], seq 14:22, ack 139, win 512, options [nop,nop,TS val 1692288287 ecr 1692288287], length 8
18:38:17.574612 IP localhost.56568 > localhost.44444: Flags [.], ack 22, win 512, options [nop,nop,TS val 1692288287 ecr 1692288287], length 0
18:38:20.814171 IP localhost.56568 > localhost.44444: Flags [P.], seq 139:159, ack 22, win 512, options [nop,nop,TS val 1692291527 ecr 1692288287], length 20
18:38:20.814241 IP localhost.44444 > localhost.56568: Flags [.], ack 159, win 512, options [nop,nop,TS val 1692291527 ecr 1692291527], length 0
18:38:20.814266 IP localhost.44444 > localhost.56568: Flags [P.], seq 22:30, ack 159, win 512, options [nop,nop,TS val 1692291527 ecr 1692291527], length 8
18:38:20.814297 IP localhost.56568 > localhost.44444: Flags [.], ack 30, win 512, options [nop,nop,TS val 1692291527 ecr 1692291527], length 0
18:38:20.814309 IP localhost.44444 > localhost.56566: Flags [P.], seq 22:48, ack 139, win 512, options [nop,nop,TS val 1692291527 ecr 1692286049], length 26
18:38:20.814340 IP localhost.56566 > localhost.44444: Flags [.], ack 48, win 512, options [nop,nop,TS val 1692291527 ecr 1692291527], length 0
18:38:25.721707 IP localhost.56566 > localhost.44444: Flags [P.], seq 139:154, ack 48, win 512, options [nop,nop,TS val 1692296434 ecr 1692291527], length 15
18:38:25.721739 IP localhost.44444 > localhost.56566: Flags [.], ack 154, win 512, options [nop,nop,TS val 1692296434 ecr 1692296434], length 0
18:38:25.721792 IP localhost.44444 > localhost.56566: Flags [P.], seq 48:56, ack 154, win 512, options [nop,nop,TS val 1692296434 ecr 1692296434], length 8
18:38:25.721797 IP localhost.56566 > localhost.44444: Flags [.], ack 56, win 512, options [nop,nop,TS val 1692296434 ecr 1692296434], length 0
18:38:25.721805 IP localhost.44444 > localhost.56568: Flags [P.], seq 30:51, ack 159, win 512, options [nop,nop,TS val 1692296434 ecr 1692291527], length 21
18:38:25.721836 IP localhost.56568 > localhost.44444: Flags [.], ack 51, win 512, options [nop,nop,TS val 1692296434 ecr 1692296434], length 0
18:38:31.729675 IP localhost.56568 > localhost.44444: Flags [P.], seq 159:198, ack 51, win 512, options [nop,nop,TS val 1692302442 ecr 1692296434], length 39
18:38:31.729676 IP localhost.56566 > localhost.44444: Flags [P.], seq 154:193, ack 56, win 512, options [nop,nop,TS val 1692302442 ecr 1692296434], length 39
18:38:31.729711 IP localhost.44444 > localhost.56566: Flags [.], ack 193, win 512, options [nop,nop,TS val 1692302442 ecr 1692302442], length 0
18:38:31.729713 IP localhost.44444 > localhost.56568: Flags [.], ack 198, win 512, options [nop,nop,TS val 1692302442 ecr 1692302442], length 0
18:38:37.104050 IP localhost.56566 > localhost.44444: Flags [P.], seq 193:232, ack 56, win 512, options [nop,nop,TS val 1692307816 ecr 1692302442], length 39
18:38:37.104180 IP localhost.44444 > localhost.56566: Flags [.], ack 232, win 512, options [nop,nop,TS val 1692307816 ecr 1692307816], length 0
18:38:37.737083 IP localhost.56568 > localhost.44444: Flags [P.], seq 198:237, ack 51, win 512, options [nop,nop,TS val 1692308449 ecr 1692302442], length 39
18:38:37.737131 IP localhost.44444 > localhost.56568: Flags [.], ack 237, win 512, options [nop,nop,TS val 1692308449 ecr 1692308449], length 0
18:38:43.330546 IP localhost.56566 > localhost.44444: Flags [P.], seq 232:271, ack 56, win 512, options [nop,nop,TS val 1692314042 ecr 1692307816], length 39
18:38:43.330577 IP localhost.44444 > localhost.56566: Flags [.], ack 271, win 512, options [nop,nop,TS val 1692314042 ecr 1692314042], length 0
18:38:43.744613 IP localhost.56568 > localhost.44444: Flags [P.], seq 237:276, ack 51, win 512, options [nop,nop,TS val 1692314457 ecr 1692308449], length 39
18:38:43.744745 IP localhost.44444 > localhost.56568: Flags [.], ack 276, win 512, options [nop,nop,TS val 1692314457 ecr 1692314457], length 0
18:38:46.600271 IP localhost.56568 > localhost.44444: Flags [P.], seq 276:293, ack 51, win 512, options [nop,nop,TS val 1692317312 ecr 1692314457], length 17
18:38:46.600305 IP localhost.44444 > localhost.56568: Flags [.], ack 293, win 512, options [nop,nop,TS val 1692317312 ecr 1692317312], length 0
18:38:46.600363 IP localhost.44444 > localhost.56568: Flags [P.], seq 51:59, ack 293, win 512, options [nop,nop,TS val 1692317312 ecr 1692317312], length 8
18:38:46.600391 IP localhost.56568 > localhost.44444: Flags [.], ack 59, win 512, options [nop,nop,TS val 1692317312 ecr 1692317312], length 0
18:38:46.600423 IP localhost.44444 > localhost.56566: Flags [P.], seq 56:79, ack 271, win 512, options [nop,nop,TS val 1692317312 ecr 1692314042], length 23
18:38:46.600428 IP localhost.56566 > localhost.44444: Flags [.], ack 79, win 512, options [nop,nop,TS val 1692317312 ecr 1692317312], length 0
18:38:49.466095 IP localhost.56566 > localhost.44444: Flags [P.], seq 271:310, ack 79, win 512, options [nop,nop,TS val 1692320178 ecr 1692317312], length 39
18:38:49.466233 IP localhost.44444 > localhost.56566: Flags [.], ack 310, win 512, options [nop,nop,TS val 1692320178 ecr 1692320178], length 0
18:38:51.637802 IP localhost.56568 > localhost.44444: Flags [P.], seq 293:300, ack 59, win 512, options [nop,nop,TS val 1692322350 ecr 1692317312], length 7
18:38:51.637869 IP localhost.44444 > localhost.56568: Flags [P.], seq 59:79, ack 300, win 512, options [nop,nop,TS val 1692322350 ecr 1692322350], length 20
18:38:51.637905 IP localhost.56568 > localhost.44444: Flags [.], ack 79, win 512, options [nop,nop,TS val 1692322350 ecr 1692322350], length 0
18:38:55.473801 IP localhost.56566 > localhost.44444: Flags [P.], seq 310:349, ack 79, win 512, options [nop,nop,TS val 1692326186 ecr 1692320178], length 39
18:38:55.473928 IP localhost.44444 > localhost.56566: Flags [.], ack 349, win 512, options [nop,nop,TS val 1692326186 ecr 1692326186], length 0
18:38:57.645469 IP localhost.56568 > localhost.44444: Flags [P.], seq 300:339, ack 79, win 512, options [nop,nop,TS val 1692328357 ecr 1692322350], length 39
18:38:57.690722 IP localhost.44444 > localhost.56568: Flags [.], ack 339, win 512, options [nop,nop,TS val 1692328403 ecr 1692328357], length 0
18:39:01.481536 IP localhost.56566 > localhost.44444: Flags [P.], seq 349:388, ack 79, win 512, options [nop,nop,TS val 1692332193 ecr 1692326186], length 39
18:39:01.481669 IP localhost.44444 > localhost.56566: Flags [.], ack 388, win 512, options [nop,nop,TS val 1692332193 ecr 1692332193], length 0
18:39:03.651894 IP localhost.56568 > localhost.44444: Flags [P.], seq 339:378, ack 79, win 512, options [nop,nop,TS val 1692334365 ecr 1692328403], length 39
18:39:03.652019 IP localhost.44444 > localhost.56568: Flags [.], ack 378, win 512, options [nop,nop,TS val 1692334365 ecr 1692334365], length 0
18:39:06.953658 IP localhost.56568 > localhost.44444: Flags [P.], seq 378:394, ack 79, win 512, options [nop,nop,TS val 1692337667 ecr 1692334365], length 16
18:39:06.953690 IP localhost.44444 > localhost.56568: Flags [.], ack 394, win 512, options [nop,nop,TS val 1692337667 ecr 1692337667], length 0
18:39:06.953730 IP localhost.44444 > localhost.56568: Flags [P.], seq 79:87, ack 394, win 512, options [nop,nop,TS val 1692337667 ecr 1692337667], length 8
18:39:06.953767 IP localhost.56568 > localhost.44444: Flags [.], ack 87, win 512, options [nop,nop,TS val 1692337667 ecr 1692337667], length 0
18:39:06.953785 IP localhost.44444 > localhost.56566: Flags [P.], seq 79:101, ack 388, win 512, options [nop,nop,TS val 1692337667 ecr 1692332193], length 22
18:39:06.953790 IP localhost.56566 > localhost.44444: Flags [.], ack 101, win 512, options [nop,nop,TS val 1692337667 ecr 1692337667], length 0
18:39:07.487941 IP localhost.56566 > localhost.44444: Flags [P.], seq 388:427, ack 101, win 512, options [nop,nop,TS val 1692338201 ecr 1692337667], length 39
18:39:07.488059 IP localhost.44444 > localhost.56566: Flags [.], ack 427, win 512, options [nop,nop,TS val 1692338201 ecr 1692338201], length 0
18:39:12.961483 IP localhost.56568 > localhost.44444: Flags [P.], seq 394:433, ack 87, win 512, options [nop,nop,TS val 1692343674 ecr 1692337667], length 39
18:39:12.961521 IP localhost.44444 > localhost.56568: Flags [.], ack 433, win 512, options [nop,nop,TS val 1692343674 ecr 1692343674], length 0
18:39:13.495901 IP localhost.56566 > localhost.44444: Flags [P.], seq 427:466, ack 101, win 512, options [nop,nop,TS val 1692344209 ecr 1692338201], length 39
18:39:13.496027 IP localhost.44444 > localhost.56566: Flags [.], ack 466, win 512, options [nop,nop,TS val 1692344209 ecr 1692344209], length 0
18:39:16.575903 IP localhost.56568 > localhost.44444: Flags [P.], seq 433:454, ack 87, win 512, options [nop,nop,TS val 1692347289 ecr 1692343674], length 21
18:39:16.575909 IP localhost.44444 > localhost.56568: Flags [.], ack 454, win 512, options [nop,nop,TS val 1692347289 ecr 1692347289], length 0
18:39:16.600921 IP localhost.44444 > localhost.56566: Flags [P.], seq 101:122, ack 466, win 512, options [nop,nop,TS val 1692347314 ecr 1692344209], length 21
18:39:16.600929 IP localhost.56566 > localhost.44444: Flags [.], ack 122, win 512, options [nop,nop,TS val 1692347314 ecr 1692347314], length 0
18:39:16.600938 IP localhost.44444 > localhost.56568: Flags [P.], seq 87:95, ack 454, win 512, options [nop,nop,TS val 1692347314 ecr 1692347289], length 8
18:39:16.600969 IP localhost.56568 > localhost.44444: Flags [.], ack 95, win 512, options [nop,nop,TS val 1692347314 ecr 1692347314], length 0
18:39:19.503324 IP localhost.56566 > localhost.44444: Flags [P.], seq 466:505, ack 122, win 512, options [nop,nop,TS val 1692350216 ecr 1692347314], length 39
18:39:19.503357 IP localhost.44444 > localhost.56566: Flags [.], ack 505, win 512, options [nop,nop,TS val 1692350216 ecr 1692350216], length 0
18:39:22.608267 IP localhost.56568 > localhost.44444: Flags [P.], seq 454:493, ack 95, win 512, options [nop,nop,TS val 1692353321 ecr 1692347314], length 39
18:39:22.608347 IP localhost.44444 > localhost.56568: Flags [.], ack 493, win 512, options [nop,nop,TS val 1692353321 ecr 1692353321], length 0
18:39:25.481804 IP localhost.56566 > localhost.44444: Flags [P.], seq 505:544, ack 122, win 512, options [nop,nop,TS val 1692356195 ecr 1692350216], length 39
18:39:25.481815 IP localhost.44444 > localhost.56566: Flags [.], ack 544, win 512, options [nop,nop,TS val 1692356195 ecr 1692356195], length 0
18:39:28.615380 IP localhost.56568 > localhost.44444: Flags [P.], seq 493:532, ack 95, win 512, options [nop,nop,TS val 1692359328 ecr 1692353321], length 39
18:39:28.615442 IP localhost.44444 > localhost.56568: Flags [.], ack 532, win 512, options [nop,nop,TS val 1692359328 ecr 1692359328], length 0
18:39:31.964491 IP localhost.56566 > localhost.44444: Flags [P.], seq 544:583, ack 122, win 512, options [nop,nop,TS val 1692362677 ecr 1692356195], length 39
18:39:31.964553 IP localhost.44444 > localhost.56566: Flags [.], ack 583, win 512, options [nop,nop,TS val 1692362677 ecr 1692362677], length 0
18:39:33.217521 IP localhost.56566 > localhost.44444: Flags [R.], seq 583, ack 122, win 512, options [nop,nop,TS val 1692363930 ecr 1692362677], length 0
18:39:34.622940 IP localhost.56568 > localhost.44444: Flags [P.], seq 532:571, ack 95, win 512, options [nop,nop,TS val 1692365335 ecr 1692359328], length 39
18:39:34.622949 IP localhost.44444 > localhost.56568: Flags [.], ack 571, win 512, options [nop,nop,TS val 1692365335 ecr 1692365335], length 0
18:39:40.630218 IP localhost.56568 > localhost.44444: Flags [P.], seq 571:610, ack 95, win 512, options [nop,nop,TS val 1692371343 ecr 1692365335], length 39
18:39:40.630239 IP localhost.44444 > localhost.56568: Flags [.], ack 610, win 512, options [nop,nop,TS val 1692371343 ecr 1692371343], length 0
18:39:45.306104 IP localhost.56568 > localhost.44444: Flags [F.], seq 610, ack 95, win 512, options [nop,nop,TS val 1692376018 ecr 1692371343], length 0
18:39:45.350198 IP localhost.44444 > localhost.56568: Flags [.], ack 611, win 512, options [nop,nop,TS val 1692376063 ecr 1692376018], length 0
18:39:45.357286 IP localhost.44444 > localhost.56568: Flags [F.], seq 95, ack 611, win 512, options [nop,nop,TS val 1692376070 ecr 1692376018], length 0
18:39:45.357309 IP localhost.56568 > localhost.44444: Flags [.], ack 96, win 512, options [nop,nop,TS val 1692376070 ecr 1692376070], length 0
